{
  "schema_version": "echonet.echochain_handoff.v0.1",
  "event_id": "handoff_evt_cluster_seed42_0001",
  "timestamp": "2026-01-11T04:36:00Z",
  "source_event_id": "evt_cluster_seed42_0001",
  "actor": "node_cluster_alpha_hash",
  "targets": ["reflection_ledger_candidate"],
  "context": {
    "domain": "EchoNet",
    "thread": "aethernode_cluster_coherence",
    "cluster_id": "cluster_alpha"
  },
  "seal_mode": "ledger",
  "eta_proxy": 0.41,
  "privacy_projection": {
    "raw_content_stored": false,
    "identity_mode": "node_hash",
    "published_fields": ["event_id", "timestamp", "domain", "seal_mode", "eta_proxy", "candidate_ping", "confidence"]
  },
  "candidate_ping": "whisper",
  "scoring_inputs": {
    "agency_hint": 0.2,
    "relationality_hint": 0.3,
    "persistence_hint": 0.4,
    "anomaly_risk": 0.12,
    "confidence": 0.86
  },
  "notes": "Example only. EchoChain decides scoring/reward status downstream."
}
