{
  "schema_version": "echonet.echochain_handoff.v0.1",
  "event_id": "handoff_signal_ping_0001",
  "timestamp": "2026-01-11T04:47:00Z",
  "source_event_id": "evt_cluster_anomaly_window_0001",
  "actor": "node_cluster_alpha_hash",
  "targets": ["reflection_ledger_candidate", "cluster_alpha"],
  "context": {
    "domain": "EchoNet",
    "thread": "aethernode_cluster_anomaly",
    "cluster_id": "cluster_alpha"
  },
  "seal_mode": "ledger",
  "eta_proxy": 0.62,
  "privacy_projection": {
    "raw_content_stored": false,
    "identity_mode": "node_hash",
    "published_fields": ["event_id", "timestamp", "domain", "seal_mode", "eta_proxy", "candidate_ping", "confidence", "anomaly_risk"]
  },
  "candidate_ping": "signal",
  "scoring_inputs": {
    "agency_hint": 0.24,
    "relationality_hint": 0.42,
    "persistence_hint": 0.5,
    "anomaly_risk": 0.31,
    "confidence": 0.79
  },
  "notes": "Synthetic handoff fixture. EchoChain decides ledger/scoring status downstream."
}
